{
  "$schema": "./contract.schema.json",
  "document_kind": "frozen_artifact_manifest",
  "schema_version": "1.0.0",
  "contract_id": "INTERP-001D2A0-MAT0-V0",
  "status": "FROZEN_UNEXECUTED",
  "predecessor_manifest_sha256": "8ee62993fbf302d8037f8cf898a0edca4fe7bbff7b01f73f6a71e8b6c04c3efd",
  "exec0_manifest_sha256": "1a7203d93a341c3b4570d4070d95457441da190e4c8ff167f86d89d0135c40f3",
  "payload": {
    "manifest_id": "INTERP-001D2A0-MAT0-FROZEN-ARTIFACTS-V0",
    "canonicalization_id": "interp-canonical-json-v1",
    "artifacts": [
      {
        "document_kind": "contract_schema",
        "path": "contract.schema.json",
        "visibility_lane": "CONTRACT_AUTHORITY",
        "sha256": "8f367f5916ea4df1cbb538169d97d886d3abc80ec729c28fcc993022c01c6f48"
      },
      {
        "document_kind": "composed_runner_input",
        "path": "composed-runner-input-v0.json",
        "visibility_lane": "RUNNER_VISIBLE",
        "sha256": "e940b93c9a3be0e7a0bac4c05c85dddf723118eff416ea83bd1a48041ed6f751"
      },
      {
        "document_kind": "fixture_normalization",
        "path": "fixture-normalization-v0.json",
        "visibility_lane": "RUNNER_VISIBLE",
        "sha256": "b9956cac34fce4e7834fec08f6044c2f681fc5b650c727dc81439d8b0f48b5e7"
      },
      {
        "document_kind": "operator_program",
        "path": "operator-program-v0.json",
        "visibility_lane": "RUNNER_VISIBLE",
        "sha256": "875b40389d0e158999144c0d1d94e29d0b26675a2831bb5f43c56a73c72c074c"
      },
      {
        "document_kind": "record_materialization",
        "path": "record-materialization-v0.json",
        "visibility_lane": "RUNNER_VISIBLE",
        "sha256": "ba25d9280a2ff8f1ea00c27d477129290b71d151ef4ff25872329b80a9b43d40"
      },
      {
        "document_kind": "lifecycle_emission",
        "path": "lifecycle-emission-v0.json",
        "visibility_lane": "RUNNER_VISIBLE",
        "sha256": "be27ac693e7b69e9678dfce6ebe6c3ec24cf3ee69c4cdd5ac72954b2ecbe8b99"
      },
      {
        "document_kind": "rejection_materialization",
        "path": "rejection-materialization-v0.json",
        "visibility_lane": "RUNNER_VISIBLE",
        "sha256": "bcb3d036954d3febece1bd097056ea69e73a40d9c52af11fa06949c475e3b194"
      },
      {
        "document_kind": "digest_contract",
        "path": "digest-contract-v0.json",
        "visibility_lane": "RUNNER_AND_EVALUATOR_VISIBLE",
        "sha256": "7e641b92b4ed500b3c9f8fb85e57e4b25451b032aedbf36a0def73afefb1b61d"
      },
      {
        "document_kind": "evaluation_v1_schema",
        "path": "evaluation-v1.schema.json",
        "visibility_lane": "EVALUATOR_ONLY",
        "sha256": "717e57a480840e3dba67475eb3a50abe91af554aa9fc311f402659f42d93d6c2"
      },
      {
        "document_kind": "publication_v1_schema",
        "path": "publication-v1.schema.json",
        "visibility_lane": "PUBLICATION_ONLY",
        "sha256": "fa970e9c545270f6b5e6befe6d1aa452a2be4ecf173e03f820560c7552ef6ea0"
      },
      {
        "document_kind": "source_bundle_contract",
        "path": "source-bundle-contract-v0.json",
        "visibility_lane": "PUBLICATION_ONLY",
        "sha256": "43d52a8f5e010a0beebc327136f99c60715533b343676f54cac166ab2fd4ce4f"
      },
      {
        "document_kind": "materialization_golden_traces",
        "path": "materialization-golden-traces-v0.json",
        "visibility_lane": "CONTRACT_TEST_ONLY",
        "sha256": "d42da6b1af037f2eba79395e37ffcdbe6c66d5a08dd8271afb3edab4d73afbff"
      }
    ]
  }
}
